"DESCRIPTION","DURATION IN MS","NAME","PARENT SUITE","START TIME","STATUS","STOP TIME","SUB SUITE","SUITE","TEST CLASS","TEST METHOD"
"","12905","Navigate to Transfer Page","","2026-07-11","passed","2026-07-11","","Dashboard","Navigate to Transfer Page",""
"","11831","Logout","","2026-07-11","passed","2026-07-11","","Dashboard","Logout",""
"","11793","Login with valid credentials","","2026-07-11","passed","2026-07-11","","Login","Login with valid credentials",""
"","13476","Failed Transfer and input amount is null","","2026-07-11","passed","2026-07-11","","Transfer","Failed Transfer and input amount is null",""
"","10311","Login with invalid credentials","","2026-07-11","passed","2026-07-11","","Login","Login with invalid credentials",""
"","19311","Successful Transfer","","2026-07-11","passed","2026-07-11","","Transfer","Successful Transfer",""
